{
  "$schema": "https://json-schema.org/draft/2020-12/schema",
  "$id": "https://asterion.local/schemas/control-plane/v1/control-plane-manifest.schema.json",
  "title": "Asterion Control Plane Manifest v1",
  "type": "object",
  "additionalProperties": false,
  "required": [
    "protocol",
    "control_plane_id",
    "version",
    "commands",
    "events",
    "capabilities",
    "continuation_media_type",
    "checkpoint_version",
    "compatibility_ids"
  ],
  "properties": {
    "protocol": {"const": "asterion.control-plane/v1"},
    "control_plane_id": {"$ref": "#/$defs/identifier"},
    "version": {"$ref": "#/$defs/version"},
    "commands": {
      "$comment": "Validators enforce Unicode-scalar ascending order and uniqueness.",
      "type": "array",
      "minItems": 1,
      "uniqueItems": true,
      "items": {
        "enum": [
          "action.resolve",
          "checkpoint.request",
          "input.submit",
          "session.attach",
          "session.cancel",
          "session.create",
          "session.pause",
          "session.resume"
        ]
      }
    },
    "events": {
      "$comment": "Validators enforce Unicode-scalar ascending order and uniqueness.",
      "type": "array",
      "minItems": 1,
      "uniqueItems": true,
      "items": {
        "enum": [
          "action.proposed",
          "budget.reported",
          "checkpoint.created",
          "fault.raised",
          "goal.updated",
          "session.budget-limited",
          "session.cancelled",
          "session.completed",
          "session.created",
          "session.failed",
          "session.paused",
          "session.recovery-required",
          "session.running"
        ]
      }
    },
    "capabilities": {"$ref": "#/$defs/identifiers"},
    "continuation_media_type": {
      "type": "string",
      "pattern": "^[a-z0-9][a-z0-9!#$&^_.+-]*/[a-z0-9][a-z0-9!#$&^_.+-]*$"
    },
    "checkpoint_version": {"$ref": "#/$defs/version"},
    "compatibility_ids": {
      "$comment": "Validators enforce Unicode-scalar ascending order and uniqueness.",
      "type": "array",
      "minItems": 1,
      "uniqueItems": true,
      "items": {
        "type": "string",
        "pattern": "^[a-z][a-z0-9.-]*/v[1-9][0-9]*$"
      }
    }
  },
  "$defs": {
    "identifier": {
      "type": "string",
      "pattern": "^[a-z][a-z0-9]*(?:[.-][a-z0-9]+)*$"
    },
    "version": {
      "type": "string",
      "pattern": "^(?:0|[1-9][0-9]*)\\.(?:0|[1-9][0-9]*)\\.(?:0|[1-9][0-9]*)$"
    },
    "identifiers": {
      "$comment": "Validators enforce Unicode-scalar ascending order and uniqueness.",
      "type": "array",
      "uniqueItems": true,
      "items": {"$ref": "#/$defs/identifier"}
    }
  }
}
